<?xml version="1.0" encoding="UTF-8"?>

<!DOCTYPE SensorType  SYSTEM "SensorTypeDTD.dtd" >

<SensorType name="org.cougaar.coordinator.examples.RestartDefense.RestartDiagnosis" 
            sensesAssetType="Agent"
            sensesStateDimension="Liveness" 
		sensorLatency="120000">
    <PotentialDiagnoses>
        <Diagnosis name="Live" />
        <Diagnosis name="Dead" />
    </PotentialDiagnoses>
    <Diagnoses>
        <WhenActualStateIs name="Live" >
            <WillDiagnoseAs name="Live" withProbability="0.99" />
            <WillDiagnoseAs name="Dead" withProbability="0.01" />
        </WhenActualStateIs >
        <WhenActualStateIs name="Dead" >
            <WillDiagnoseAs name="Dead" withProbability="0.99" />
            <WillDiagnoseAs name="Live" withProbability="0.01" />
        </WhenActualStateIs >
    </Diagnoses>
</SensorType>
